date,time,content,is_posted
2027-01-31,13:58,Observation: Question everything. Even the compiler.,False
2027-01-31,15:15,watch me.,False
2027-01-31,15:19,Connecting the dots between Ancient Hindu texts and modern AI.,False
2027-01-31,15:27,1/ Quality over quantity. 🧵,False
2027-01-31,15:32,"Observation: History doesn't repeat itself, but human nature does.",False
2027-01-31,15:34,Note to self: Execution > Ideas.,False
2027-01-31,16:20,Do you agree? Obsession is only a disease if you're average.,False
2027-01-31,16:41,Do you agree? Be a ghost. Let the results haunt them.,False
2027-01-31,18:08,smiling because i have no idea what's going on in this lecture //,False
2027-01-31,18:12,"print('History doesn't repeat itself, but human nature does.')",False
2027-01-31,18:53,entropy always increases. keep your room clean to fight the universe.,False
2027-01-31,19:22,the universe is optimized for balance. be the chaos that disrupts it.,False
2027-01-31,20:01,Do you agree? Mediocrity is a crowded place. I prefer the solitude of excellence.,False
2027-01-31,20:20,Rest day? Never heard of her.,False
2027-01-31,20:24,Read this carefully: Focus on the output.,False
2027-01-31,20:28,1/ Rest day? Never heard of her. 🧵,False
2027-01-31,21:17,Reading philosophy to debug my own operating system (my brain).,False
2027-01-31,21:28,Do you agree? I don't make mistakes. I create unexpected learning opportunities.,False
2027-01-31,21:51,pain is temporary quitting lasts forever //,False
2027-01-31,22:27,Converting caffeine into logic. #Python #Engineering #Focus,False
2027-01-31,22:54,Do you agree? Time is relative. That's why deadlines feel faster than weekends.,False
2027-01-31,23:57,Read this carefully: Project Sera: optimizing my life one line of code at a time.,False
